{"assets":[{"asset_id":"0e0e5815-a6e2-4589-99f0-7c9b123fecc4","display_name":"walden.epub","etag":"\"sha256-5d85f686470b5454e7200c7d379776b1cb62b169447505b3513374b786221f52\"","length":3146962,"media_type":"application/epub+zip","ordinal":0,"part_size":1048576,"parts":[{"index":0,"length":1048576,"offset":0,"sha256":"bdcb05be35fbfed3181a373570380fff8fc41561b3e50e146b43aaf6fc62ba95"},{"index":1,"length":1048576,"offset":1048576,"sha256":"607dd8c404545818e11fa8cf7b2e1a628f0732abd44f07d0592ccec61d011717"},{"index":2,"length":1048576,"offset":2097152,"sha256":"4afec6d9337c0551b5e8dc3b938e3863131f107cb8b93398d38b0b9843db0eb8"},{"index":3,"length":1234,"offset":3145728,"sha256":"b29f01c732b8d85c37c0da2af2ae898682038f501909c7c988ab3af7e3e1b6b1"}],"sha256":"5d85f686470b5454e7200c7d379776b1cb62b169447505b3513374b786221f52"}],"created_at":"2026-10-12T03:02:21Z","grouping":{"kind":"single","title":"walden"},"item_id":"ceb601f3-8a32-4cb4-9b8d-2074f7a068af","item_version_id":"9b48f49b-bfd8-4535-b1f6-c92616837942","manifest_digest":"8104fb29e647f0a00e6999a340310eb3182e32bfe61ae6b49b69de79202685d6","protocol_version":{"major":1,"minor":0},"schema_version":1,"source_id":"95150432-49b9-4aa5-8c39-e83c36df4303"}