{"assets":[{"asset_id":"86aa02ad-2447-45c3-9d74-6325b66a3850","display_name":"walden.epub","etag":"\"sha256-5d85f686470b5454e7200c7d379776b1cb62b169447505b3513374b786221f52\"","length":3146962,"media_type":"application/epub+zip","ordinal":0,"part_size":1048576,"parts":[{"index":0,"length":1048576,"offset":0,"sha256":"bdcb05be35fbfed3181a373570380fff8fc41561b3e50e146b43aaf6fc62ba95"},{"index":1,"length":1048576,"offset":1048576,"sha256":"607dd8c404545818e11fa8cf7b2e1a628f0732abd44f07d0592ccec61d011717"},{"index":2,"length":1048576,"offset":2097152,"sha256":"4afec6d9337c0551b5e8dc3b938e3863131f107cb8b93398d38b0b9843db0eb8"},{"index":3,"length":1234,"offset":3145728,"sha256":"b29f01c732b8d85c37c0da2af2ae898682038f501909c7c988ab3af7e3e1b6b1"}],"sha256":"5d85f686470b5454e7200c7d379776b1cb62b169447505b3513374b786221f52"}],"created_at":"2026-10-19T14:23:35Z","grouping":{"kind":"single","title":"walden"},"item_id":"11c77fa7-7bdb-42bf-98a7-bb7f0170daf8","item_version_id":"a0001b8a-a01c-4d99-9ca4-f456addee19a","manifest_digest":"12a4bf8468d33ace503b367b78cfadda55e6c11f1d49adf3146ca1f09eb04e99","protocol_version":{"major":1,"minor":0},"schema_version":1,"source_id":"64d30120-457e-4e00-92c9-b5e653179be2"}