{
  "schema_version": 1,
  "protocol_version": {
    "major": 1,
    "minor": 0
  },
  "source_id": "5a1e0c3e-7d2b-4c1a-9f00-000000000001",
  "item_id": "00000000-0000-4000-8000-000000000005",
  "item_version_id": "00000000-0000-4000-8000-000000000006",
  "created_at": "2026-10-06T09:00:00Z",
  "manifest_digest": "3b40a64b84e4c640cd13366af7c75bfd1456ce44c0e9f3ec210d79ac904c7a9f",
  "grouping": {
    "kind": "group",
    "title": "Meditations (LibriVox)",
    "creators": [
      "Marcus Aurelius",
      "George Long"
    ]
  },
  "cover_asset_id": "00000000-0000-4000-8000-000000000105",
  "assets": [
    {
      "asset_id": "00000000-0000-4000-8000-000000000103",
      "ordinal": 0,
      "display_name": "01 - Book One.mp3",
      "media_type": "audio/mpeg",
      "length": 3145745,
      "etag": "\"sha256-c44a2a484b9834e946d18c0d24d964eb773db7de805a901b2ebf7edf48ad4e45\"",
      "sha256": "c44a2a484b9834e946d18c0d24d964eb773db7de805a901b2ebf7edf48ad4e45",
      "part_size": 1048576,
      "parts": [
        {
          "index": 0,
          "offset": 0,
          "length": 1048576,
          "sha256": "129090c42dca77d5e78786a695984a2a3eb51707acaa1ffdb5360ad187bd196e"
        },
        {
          "index": 1,
          "offset": 1048576,
          "length": 1048576,
          "sha256": "b103b96c70c2ce7ee6d471c460817f465b051efb5fe8d6e3ef22c27ef990d8a3"
        },
        {
          "index": 2,
          "offset": 2097152,
          "length": 1048576,
          "sha256": "0ee680801912d6823b7649878b21001f2231b6ea43ddcb98759f015f8d138b6b"
        },
        {
          "index": 3,
          "offset": 3145728,
          "length": 17,
          "sha256": "46014019ac15bab0344df67c04f29c4c67e2794d0c62dfe555afab0e80009465"
        }
      ]
    },
    {
      "asset_id": "00000000-0000-4000-8000-000000000104",
      "ordinal": 1,
      "display_name": "02 - Book Two.mp3",
      "media_type": "audio/mpeg",
      "length": 1048577,
      "etag": "\"sha256-83c712300b78584f3c0acf643e190120c0615c3eae55180b4b7d09d99747780b\"",
      "sha256": "83c712300b78584f3c0acf643e190120c0615c3eae55180b4b7d09d99747780b",
      "part_size": 1048576,
      "parts": [
        {
          "index": 0,
          "offset": 0,
          "length": 1048576,
          "sha256": "78d86c61992198501fbe7783f817467134e68696cb9f20aad9ac583bc4f3f578"
        },
        {
          "index": 1,
          "offset": 1048576,
          "length": 1,
          "sha256": "383e5d7d58caa41ce723cf16af471b38f6ee9065c032d07fa6bef1678cb72f1d"
        }
      ]
    },
    {
      "asset_id": "00000000-0000-4000-8000-000000000105",
      "ordinal": 2,
      "display_name": "cover.jpg",
      "media_type": "image/jpeg",
      "length": 40000,
      "etag": "\"sha256-70910c485940a2e673d3b0d02de0cbe465169634873e0e7dba25b3e7f7944e37\"",
      "sha256": "70910c485940a2e673d3b0d02de0cbe465169634873e0e7dba25b3e7f7944e37",
      "part_size": 1048576,
      "parts": [
        {
          "index": 0,
          "offset": 0,
          "length": 40000,
          "sha256": "70910c485940a2e673d3b0d02de0cbe465169634873e0e7dba25b3e7f7944e37"
        }
      ]
    }
  ]
}
