{"assets":[{"asset_id":"855666a0-12fb-47a0-b8cd-b57364c8440a","display_name":"walden.epub","etag":"\"sha256-5d85f686470b5454e7200c7d379776b1cb62b169447505b3513374b786221f52\"","length":3146962,"media_type":"application/epub+zip","ordinal":0,"part_size":1048576,"parts":[{"index":0,"length":1048576,"offset":0,"sha256":"bdcb05be35fbfed3181a373570380fff8fc41561b3e50e146b43aaf6fc62ba95"},{"index":1,"length":1048576,"offset":1048576,"sha256":"607dd8c404545818e11fa8cf7b2e1a628f0732abd44f07d0592ccec61d011717"},{"index":2,"length":1048576,"offset":2097152,"sha256":"4afec6d9337c0551b5e8dc3b938e3863131f107cb8b93398d38b0b9843db0eb8"},{"index":3,"length":1234,"offset":3145728,"sha256":"b29f01c732b8d85c37c0da2af2ae898682038f501909c7c988ab3af7e3e1b6b1"}],"sha256":"5d85f686470b5454e7200c7d379776b1cb62b169447505b3513374b786221f52"}],"created_at":"2026-10-19T04:24:29Z","grouping":{"kind":"single","title":"walden"},"item_id":"07f88077-dff0-43cd-8181-4ae431fc2d39","item_version_id":"93f0e9ba-8356-4d3d-878b-d7fc52e582c0","manifest_digest":"31f8ac253e38a37113cbc93f92ef2e91009f7cfd471b82977b5647551832577f","protocol_version":{"major":1,"minor":0},"schema_version":1,"source_id":"d117e400-a017-4fb4-ac8d-e5b239307edc"}